[
  {
    "id": "kworb:album:the highlights",
    "rank": 1,
    "title": "^The Highlights (Deluxe)",
    "streams_total": 49105632318,
    "streams_daily": 23789003,
    "last_update_kworb": "2025-10-05T16:17:23.537688+00:00",
    "spotify_data_date": "2025-10-04"
  },
  {
    "id": "kworb:album:the highlights-2",
    "rank": 2,
    "title": "^The Highlights",
    "streams_total": 34529211512,
    "streams_daily": 14972246,
    "last_update_kworb": "2025-10-05T16:17:23.537688+00:00",
    "spotify_data_date": "2025-10-04"
  },
  {
    "id": "kworb:album:the weeknd in japan",
    "rank": 3,
    "title": "^The Weeknd In Japan",
    "streams_total": 18312019836,
    "streams_daily": 7464741,
    "last_update_kworb": "2025-10-05T16:17:23.537688+00:00",
    "spotify_data_date": "2025-10-04"
  },
  {
    "id": "kworb:album:starboy",
    "rank": 4,
    "title": "Starboy (Deluxe)",
    "streams_total": 17683837836,
    "streams_daily": 7047512,
    "last_update_kworb": "2025-10-05T16:17:23.537688+00:00",
    "spotify_data_date": "2025-10-04"
  },
  {
    "id": "kworb:album:starboy-2",
    "rank": 5,
    "title": "Starboy",
    "streams_total": 16291426381,
    "streams_daily": 6575824,
    "last_update_kworb": "2025-10-05T16:17:23.537688+00:00",
    "spotify_data_date": "2025-10-04"
  },
  {
    "id": "kworb:album:after hours",
    "rank": 6,
    "title": "After Hours (Deluxe)",
    "streams_total": 15014558080,
    "streams_daily": 6197954,
    "last_update_kworb": "2025-10-05T16:17:23.537688+00:00",
    "spotify_data_date": "2025-10-04"
  },
  {
    "id": "kworb:album:after hours-2",
    "rank": 7,
    "title": "After Hours (Deluxe)",
    "streams_total": 13038354012,
    "streams_daily": 5013201,
    "last_update_kworb": "2025-10-05T16:17:23.537688+00:00",
    "spotify_data_date": "2025-10-04"
  },
  {
    "id": "kworb:album:after hours-3",
    "rank": 8,
    "title": "After Hours",
    "streams_total": 12685468832,
    "streams_daily": 4931181,
    "last_update_kworb": "2025-10-05T16:17:23.537688+00:00",
    "spotify_data_date": "2025-10-04"
  },
  {
    "id": "kworb:album:beauty behind the madness",
    "rank": 9,
    "title": "Beauty Behind The Madness",
    "streams_total": 11034927616,
    "streams_daily": 3992097,
    "last_update_kworb": "2025-10-05T16:17:23.537688+00:00",
    "spotify_data_date": "2025-10-04"
  },
  {
    "id": "kworb:album:beauty behind the madness-2",
    "rank": 10,
    "title": "Beauty Behind The Madness",
    "streams_total": 10824973673,
    "streams_daily": 3931372,
    "last_update_kworb": "2025-10-05T16:17:23.537688+00:00",
    "spotify_data_date": "2025-10-04"
  },
  {
    "id": "kworb:album:dawn fm",
    "rank": 11,
    "title": "Dawn FM (Alternate World)",
    "streams_total": 5611083449,
    "streams_daily": 2841208,
    "last_update_kworb": "2025-10-05T16:17:23.537688+00:00",
    "spotify_data_date": "2025-10-04"
  },
  {
    "id": "kworb:album:dawn fm-2",
    "rank": 12,
    "title": "Dawn FM (Alternate World)",
    "streams_total": 5542095779,
    "streams_daily": 2824157,
    "last_update_kworb": "2025-10-05T16:17:23.537688+00:00",
    "spotify_data_date": "2025-10-04"
  },
  {
    "id": "kworb:album:dawn fm-3",
    "rank": 13,
    "title": "Dawn FM (Alternate World)",
    "streams_total": 5520521060,
    "streams_daily": 2817008,
    "last_update_kworb": "2025-10-05T16:17:23.537688+00:00",
    "spotify_data_date": "2025-10-04"
  },
  {
    "id": "kworb:album:trilogy",
    "rank": 14,
    "title": "Trilogy",
    "streams_total": 5066228125,
    "streams_daily": 3309552,
    "last_update_kworb": "2025-10-05T16:17:23.537688+00:00",
    "spotify_data_date": "2025-10-04"
  },
  {
    "id": "kworb:album:trilogy-2",
    "rank": 15,
    "title": "Trilogy",
    "streams_total": 4998872327,
    "streams_daily": 3276673,
    "last_update_kworb": "2025-10-05T16:17:23.537688+00:00",
    "spotify_data_date": "2025-10-04"
  },
  {
    "id": "kworb:album:my dear melancholy",
    "rank": 16,
    "title": "My Dear Melancholy,",
    "streams_total": 4960593872,
    "streams_daily": 2045479,
    "last_update_kworb": "2025-10-05T16:17:23.537688+00:00",
    "spotify_data_date": "2025-10-04"
  },
  {
    "id": "kworb:album:dawn fm-4",
    "rank": 17,
    "title": "Dawn FM",
    "streams_total": 3757641464,
    "streams_daily": 1753004,
    "last_update_kworb": "2025-10-05T16:17:23.537688+00:00",
    "spotify_data_date": "2025-10-04"
  },
  {
    "id": "kworb:album:house of balloons",
    "rank": 18,
    "title": "House Of Balloons (Original)",
    "streams_total": 3515700579,
    "streams_daily": 2640587,
    "last_update_kworb": "2025-10-05T16:17:23.537688+00:00",
    "spotify_data_date": "2025-10-04"
  },
  {
    "id": "kworb:album:hurry up tomorrow",
    "rank": 19,
    "title": "Hurry Up Tomorrow",
    "streams_total": 2870162038,
    "streams_daily": 5699558,
    "last_update_kworb": "2025-10-05T16:17:23.537688+00:00",
    "spotify_data_date": "2025-10-04"
  },
  {
    "id": "kworb:album:after hours-4",
    "rank": 20,
    "title": "After Hours (Remixes)",
    "streams_total": 1214915336,
    "streams_daily": 359652,
    "last_update_kworb": "2025-10-05T16:17:23.537688+00:00",
    "spotify_data_date": "2025-10-04"
  },
  {
    "id": "kworb:album:kiss land",
    "rank": 21,
    "title": "Kiss Land (Deluxe)",
    "streams_total": 929763717,
    "streams_daily": 379127,
    "last_update_kworb": "2025-10-05T16:17:23.537688+00:00",
    "spotify_data_date": "2025-10-04"
  },
  {
    "id": "kworb:album:kiss land-2",
    "rank": 22,
    "title": "Kiss Land",
    "streams_total": 811088804,
    "streams_daily": 329365,
    "last_update_kworb": "2025-10-05T16:17:23.537688+00:00",
    "spotify_data_date": "2025-10-04"
  },
  {
    "id": "kworb:album:thursday",
    "rank": 23,
    "title": "Thursday (Original)",
    "streams_total": 660531148,
    "streams_daily": 314045,
    "last_update_kworb": "2025-10-05T16:17:23.537688+00:00",
    "spotify_data_date": "2025-10-04"
  },
  {
    "id": "kworb:album:echoes of silence",
    "rank": 24,
    "title": "Echoes Of Silence (Original)",
    "streams_total": 586080803,
    "streams_daily": 222949,
    "last_update_kworb": "2025-10-05T16:17:23.537688+00:00",
    "spotify_data_date": "2025-10-04"
  },
  {
    "id": "kworb:album:live at sofi stadium",
    "rank": 25,
    "title": "Live At SoFi Stadium",
    "streams_total": 211908810,
    "streams_daily": 113770,
    "last_update_kworb": "2025-10-05T16:17:23.537688+00:00",
    "spotify_data_date": "2025-10-04"
  },
  {
    "id": "kworb:album:music",
    "rank": 26,
    "title": "MUSIC",
    "streams_total": 210610187,
    "streams_daily": 498787,
    "last_update_kworb": "2025-10-05T16:17:23.537688+00:00",
    "spotify_data_date": "2025-10-04"
  },
  {
    "id": "kworb:album:avatar the way of water",
    "rank": 27,
    "title": "^Avatar: The Way of Water (Original Motion Picture Soundtrack)",
    "streams_total": 84715971,
    "streams_daily": 18480,
    "last_update_kworb": "2025-10-05T16:17:23.537688+00:00",
    "spotify_data_date": "2025-10-04"
  }
]